risk_id,risk_type,risk_description,mitigation,suggestions,owner
R01,Quality Gate Defect Leakage Risk,"Defect leakage of 3-4% identified in sprints 15-20; 51 open bugs (12 High, 39 Medium) with 22 in progress; High defect density in QA testing phase; Potential escaped defects reaching production; Insufficient quality gates and code review processes","Implement enhanced defect triage process with daily stand-ups; Strengthen quality gates at each sprint phase with mandatory code reviews; Expand regression test automation coverage to 95%+ for both API and UI; Conduct root cause analysis (RCA) for all High severity defects; Implement shift-left testing practices with unit test coverage targets of 80%+; Deploy automated static code analysis tools (SonarQube, Veracode) in CI/CD pipeline","Establish defect prevention workshops with development teams; Implement peer code review mandate before QA handoff; Create defect prediction models using historical data; Conduct weekly quality metrics review sessions; Implement test-driven development (TDD) practices; Schedule regular knowledge sharing sessions on common defect patterns","QA Lead, Development Lead"
R02,Dependency-Driven Development Blockage,"AXOS-1001 blocked requiring HLD approvals; Story readiness coordination across multiple stakeholders (Lavanya, Andrew, Satish, Kannan); USPS address validation and GoAnywhere file scanning requiring executive attention; Multiple approval dependencies creating cascading delays; Lack of parallel workstream planning","Establish daily dependency resolution stand-ups with all stakeholders; Create escalation matrix for blocked items with 24-hour resolution SLA; Implement parallel workstream planning to reduce critical path dependencies; Set up dedicated approval fast-track process for critical blockers; Document all dependencies in JIRA with clear ownership and target dates; Conduct bi-weekly dependency review sessions with executive sponsors","Implement dependency mapping tool to visualize critical path; Create backup plans for high-risk dependencies; Establish pre-approved design patterns to reduce approval cycles; Set up automated notification system for approaching dependency deadlines; Conduct proactive stakeholder alignment sessions N+2 sprints ahead; Create technical decision-making framework to expedite approvals","Project Manager, Technical Lead, Stakeholder Coordination Lead"
R03,Security Vulnerability Remediation Delay,"AXOS-1022 blocked requiring BurpSuite security findings remediation; Security scan results pending action before production deployment; CISO testing and sign-off pending; Unresolved security vulnerabilities blocking go-live; Service account authentication issues identified","Prioritize BurpSuite findings remediation with dedicated security sprint; Establish security remediation task force with daily progress tracking; Implement automated security scanning in CI/CD pipeline for early detection; Conduct parallel security testing during development phases; Create security checklist for production readiness with mandatory sign-offs; Schedule weekly security review sessions with CISO office","Implement DevSecOps practices with security-as-code approach; Conduct security training for development teams on OWASP Top 10; Establish security champions program within development teams; Implement automated vulnerability scanning on every code commit; Create security debt tracking and reduction plan; Schedule penetration testing early in release cycles","Security Lead, CISO Office, DevSecOps Engineer"
R04,Infrastructure Environment Readiness Gap,"AXOS-1002 blocked requiring environment access validation; Permissions for Billie Part 2 work not granted; Network downtime impacting enterprise services; Environment configuration issues ongoing; AWS Bedrock and Azure infrastructure dependencies unresolved","Expedite environment access provisioning with infrastructure team escalation; Validate all permissions and network configurations with comprehensive checklist; Establish environment readiness criteria with go/no-go decision gates; Implement infrastructure-as-code (IaC) for consistent environment provisioning; Set up monitoring and alerting for environment health and availability; Create environment troubleshooting runbook for common issues","Implement automated environment provisioning using Terraform/CloudFormation; Establish dedicated infrastructure support rotation for critical phases; Create environment parity validation scripts for DEV/QA/UAT/PROD; Set up infrastructure health dashboard with real-time monitoring; Conduct infrastructure disaster recovery drills; Implement environment access request automation with approval workflows","Infrastructure Lead, Cloud Architect, DevOps Engineer"
R05,Third-Party Integration Dependency Risk,"AXOS-1014 USPS address validation requiring third-party services; Decision pending on integration approach; Reuse of existing AXOS solutions under evaluation; Integration approach unresolved impacting all Milestone 1 modules (Deposits 45%, Receipts, Commissions 60%, Billie 78%); Potential for manual workarounds reducing automation benefits","Conduct rapid evaluation workshop to finalize USPS integration approach within 1 week; Develop proof-of-concept for both new integration and AXOS solution reuse options; Create decision matrix with cost-benefit analysis for executive approval; Establish fallback integration approach with defined acceptance criteria; Document integration architecture and API contracts; Set up integration testing environment with mock services","Implement API gateway pattern for third-party integration abstraction; Create integration monitoring dashboard with SLA tracking; Establish vendor management process for third-party service dependencies; Develop integration resilience patterns (circuit breaker, retry logic, fallback); Conduct integration security review for data privacy compliance; Create integration documentation and runbooks for operations team","Integration Architect, Technical Lead, Product Owner"
R06,Data Migration Strategy Uncertainty,"AXOS-1018 data migration runbook finalization pending; Data migration progress slow with approach document ETA-TBD; POC on Chart of Accounts in progress; Beta customer onboarding readiness at risk; Undefined data migration strategy and delayed execution plan","Finalize data migration strategy and approach document within 2 weeks with stakeholder sign-off; Complete Chart of Accounts POC and conduct lessons learned session; Develop comprehensive data migration runbook with step-by-step procedures; Establish data validation framework with quality gates at each migration phase; Create rollback procedures for migration failure scenarios; Set up dedicated data migration team with clear roles and responsibilities","Implement automated data migration scripts with validation checkpoints; Conduct data migration dry runs in non-production environments; Create data mapping documentation with source-to-target traceability; Establish data quality metrics and acceptance criteria; Develop data reconciliation reports for post-migration validation; Schedule data migration training sessions for operations team","Data Migration Lead, Data Engineer, Database Administrator"
R07,Performance SLA Compliance Risk,"AXOS-1017 performance profiling required against UI (10 seconds) and API (3 seconds) SLAs; Performance testing and workload distribution analysis in progress; Stringent performance requirements with potential for SLA breach; Risk of code refactoring and infrastructure capacity enhancement needs","Conduct comprehensive performance baseline testing across all modules; Implement performance monitoring with APM tools (New Relic, Dynatrace, AppDynamics); Execute load testing using Blazemeter/JMeter with production-like workloads; Identify and optimize performance bottlenecks in code and database queries; Conduct infrastructure capacity planning and scaling analysis; Establish performance budgets for each API and UI component","Implement performance testing in CI/CD pipeline for continuous validation; Create performance optimization guidelines and coding standards; Conduct performance tuning workshops for development teams; Implement caching strategies (Redis, CDN) for frequently accessed data; Optimize database queries with indexing and query plan analysis; Set up real-time performance dashboards for production monitoring","Performance Engineer, DevOps Lead, Infrastructure Architect"
R08,API Security Architecture Gap,"AXOS-1021 API inventory completion and service-account controls for private endpoints required; Public vs private API separation with service token authentication critical priority (target 4/10); Incomplete API security implementation exposing unauthorized access vulnerabilities; API Gateway and authentication framework gaps","Complete API inventory with classification (public/private/internal) and security requirements; Implement service account authentication with OAuth 2.0/JWT tokens for all private APIs; Deploy API Gateway with rate limiting, throttling, and access control policies; Conduct API security assessment and penetration testing; Implement API versioning strategy with backward compatibility; Create API security documentation and developer guidelines","Implement API security scanning tools (OWASP ZAP, Burp Suite) in CI/CD pipeline; Establish API security standards based on OWASP API Security Top 10; Conduct API security training for development teams; Implement API monitoring and anomaly detection for suspicious access patterns; Create API security incident response playbook; Schedule regular API security audits and compliance reviews","API Security Architect, Security Lead, DevOps Engineer"
R09,Reporting Scope Change Impact Risk,"AXOS-1003 blocked requiring reporting requirements and infrastructure setup completion; WSR decision D-016 adding new SAVE/SAVE AS functionality at Customer/Client/User level (target 4/16); Reporting POC review may result in design changes impacting completed deliverables; Scope changes causing rework of completed modules","Implement formal change control process with impact assessment for all scope changes; Conduct reporting requirements validation workshop with stakeholders; Create reporting architecture that accommodates future enhancements with minimal rework; Establish scope change approval workflow with executive sign-off; Document all scope changes with effort estimates and timeline impacts; Set up reporting infrastructure with scalability and flexibility considerations","Implement modular reporting architecture with plug-and-play components; Create reporting framework with configurable templates and parameters; Conduct regular scope review sessions to identify changes early; Establish reporting requirements traceability matrix; Implement version control for reporting components; Create reporting testing strategy with automated regression tests","Reporting Lead, Business Analyst, Product Owner"
R10,Technical Debt Accumulation Risk,"AXOS-1028 Angular, .NET, and SQL Server upgrade path assessment required; 10 technical debt items tracked including API versioning (completed 3/19), stored procedures to EF migration (target 7/17), N-1 support strategy review; Deferred technical upgrades creating maintenance burden and security vulnerabilities","Create technical debt reduction roadmap with prioritized backlog; Allocate 20% of sprint capacity for technical debt remediation; Conduct technology stack upgrade assessment with risk-benefit analysis; Implement automated dependency scanning for outdated packages and security vulnerabilities; Establish technical debt review board with quarterly assessment; Document technical debt items with business impact and remediation effort","Implement continuous technology upgrade strategy with incremental updates; Create technical debt metrics dashboard with trend analysis; Conduct architecture review sessions to identify emerging technical debt; Establish coding standards and best practices to prevent new technical debt; Implement automated code quality gates to prevent technical debt accumulation; Schedule regular technology stack health assessments","Technical Architect, Development Lead, DevOps Engineer"
R11,Cross-POD Dependency Coordination Risk,"AXOS-1025 coordination of cross-POD dependencies and integration handoffs across Alpha, Cypher, Nexus, and Apex teams required; Shared services team reporting issues with 40% completion on File Upload/Preview/Metadata and 20% on RBAC Subfunctions; Uncoordinated handoffs creating integration bottlenecks","Establish cross-POD coordination council with weekly sync meetings; Create integration dependency matrix with clear ownership and timelines; Implement integration testing strategy with shared test environments; Establish API contract-first development approach with versioned contracts; Create integration handoff checklist with acceptance criteria; Set up cross-POD communication channels (Slack, Teams) for real-time coordination","Implement integration hub architecture for centralized coordination; Create shared services roadmap with clear delivery milestones; Conduct cross-POD integration workshops for alignment; Establish integration testing automation framework; Implement integration monitoring dashboard with dependency tracking; Schedule regular cross-POD retrospectives for continuous improvement","Integration Manager, POD Leads, Project Manager"
R12,UAT Environment and Data Readiness Gap,"AXOS-1008 blocked requiring UAT and regression scope preparation for Release 0.4; Staggered module delivery with Bank Accounts UAT on 3/2, Vendors on 3/19, Delegations on 3/20, Document Vault on 3/27; 51 open bugs (12 High, 39 Medium); UAT environment and test data unavailability delaying user acceptance testing","Expedite UAT environment provisioning with production-like configuration; Create comprehensive test data management strategy with data masking for PII/PHI; Develop UAT test plan with clear entry/exit criteria and acceptance criteria; Establish UAT defect triage process with priority-based resolution; Conduct UAT readiness assessment with go/no-go criteria; Set up UAT support team with dedicated resources for issue resolution","Implement automated test data generation and refresh processes; Create UAT environment monitoring with health checks; Establish UAT user training program with hands-on sessions; Implement UAT feedback collection mechanism for continuous improvement; Create UAT execution dashboard with real-time progress tracking; Schedule UAT dry runs before official testing cycles","QA Lead, UAT Coordinator, Business Analyst"
R13,Regression Automation Coverage Gap,"AXOS-1020 expansion of regression automation coverage required; API regression automation at 56% completion (target 4/9) with 5% manual testing; TestIM UI automation at 95% with 5% manual testing; Incomplete automation coverage increasing manual testing effort and cycle time","Accelerate API regression automation development with dedicated automation engineers; Implement automation framework with reusable components and page object model; Expand automation coverage to critical business flows and high-risk areas; Establish automation code review process with quality standards; Integrate automation tests in CI/CD pipeline for continuous regression testing; Create automation execution dashboard with pass/fail trends and coverage metrics","Implement AI-powered test automation tools for intelligent test generation; Conduct automation training workshops for QA team; Establish automation best practices and coding standards; Implement visual regression testing for UI components; Create automation maintenance strategy for test stability; Schedule regular automation health assessments and optimization","QA Automation Lead, QA Engineer, DevOps Engineer"
R14,Data Model Instability Risk,"AXOS-1023 stabilization of data model changes for deposits, receipts, and commissions required to freeze schema changes; Reconciliation of shared-service dependencies needed; WSR decision D-030 approving interim approach for master data upload; Repeated data model updates creating rework loops and schema conflicts","Establish data model governance process with change control board; Freeze data model schema for Milestone 1 modules with formal sign-off; Conduct data model impact analysis for all proposed changes; Implement database version control with migration scripts; Create data model documentation with entity-relationship diagrams; Establish data model review cadence with stakeholder alignment","Implement database schema comparison tools for change detection; Create data model testing strategy with automated validation; Conduct data architecture review sessions for long-term stability; Establish data modeling standards and best practices; Implement data lineage tracking for impact analysis; Schedule regular data model health assessments","Data Architect, Database Administrator, Data Engineer"
R15,Document Vault File Scanning Integration Failure,"GoAnywhere file scanning enablement issue with file movement from Unscanned to Scanned folder not happening as expected; Troubleshooting meeting scheduled for 3/18; Document Vault functionality blocked (UAT target 3/27); Integration issues with webhook APIs","Conduct intensive troubleshooting session with GoAnywhere vendor support; Implement detailed logging and monitoring for file scanning workflow; Create file scanning test scenarios with various file types and sizes; Establish file scanning SLA with retry and error handling mechanisms; Document file scanning architecture and configuration; Set up file scanning monitoring dashboard with alerts for failures","Implement alternative file scanning solution as contingency; Create file scanning runbook with troubleshooting procedures; Conduct file scanning performance testing under load; Establish file scanning security validation process; Implement file scanning audit trail for compliance; Schedule regular file scanning health checks","Integration Engineer, Document Management Lead, Infrastructure Engineer"
R16,Banking Integration Testing Complexity,"Banking integration DEV cursory testing for NACHA in progress with data flowing and JE created but not posted requiring ASC investigation; Multiple banking integration HLDs pending (AXOS wire confirmations ETA-TBD delayed); Incomplete banking integration testing and unresolved posting issues delaying Milestone 2 delivery","Prioritize NACHA posting issue resolution with banking system experts; Conduct end-to-end banking integration testing with production-like scenarios; Finalize banking integration HLDs with stakeholder approval; Establish banking integration test environment with mock banking services; Create banking integration validation framework with reconciliation reports; Set up banking integration monitoring with transaction tracking","Implement banking integration resilience patterns (idempotency, compensation transactions); Create banking integration runbook with error handling procedures; Conduct banking integration security assessment for PCI-DSS compliance; Establish banking integration SLA monitoring with alerting; Implement banking integration audit trail for financial compliance; Schedule regular banking integration health assessments","Banking Integration Lead, Financial Systems Architect, QA Lead"
R17,AAVA 2.0 Tooling Stability Risk,"AXOS-1019 closure of AAVA 2.0 UI issues including Execute tab, Agent Edit, and KB creation problems required; AKS cluster upgrade to version 1.33 completed on 3/20; Unresolved AAVA 2.0 tooling issues reducing development productivity and automation capabilities","Prioritize AAVA 2.0 issue resolution with dedicated support team; Conduct AAVA 2.0 stability testing after AKS cluster upgrade; Create AAVA 2.0 issue tracking dashboard with resolution timelines; Establish AAVA 2.0 support escalation process for critical issues; Document AAVA 2.0 known issues and workarounds; Set up AAVA 2.0 monitoring with health checks","Implement AAVA 2.0 backup tooling for critical workflows; Create AAVA 2.0 user training program for optimal utilization; Conduct AAVA 2.0 ROI assessment and optimization; Establish AAVA 2.0 feedback collection mechanism; Implement AAVA 2.0 version control and rollback procedures; Schedule regular AAVA 2.0 health assessments","AAVA Support Lead, DevOps Engineer, Development Lead"
R18,Key Resource Attrition Risk,"AXOS-1026 backup coverage and cross-training plan setup required; Historical risk patterns showing loss of key team members (2x DB Architects, Solution Architect, Product Owner, Delivery Leader, Testing Lead) in previous projects; Key resource attrition without adequate knowledge transfer creating delivery disruptions","Implement comprehensive knowledge transfer program with documentation and shadowing; Create cross-training matrix with skill coverage across team members; Establish succession planning for critical roles with identified backups; Implement knowledge management system with centralized documentation repository; Conduct regular knowledge sharing sessions and brown bag lunches; Create retention strategy with career development plans and competitive compensation","Implement pair programming and code review practices for knowledge distribution; Create technical documentation standards with mandatory updates; Conduct exit interviews to identify retention improvement areas; Establish mentorship program for skill development; Implement team rotation strategy for broader exposure; Schedule regular one-on-one sessions to address concerns proactively","HR Manager, Project Manager, Delivery Manager"
R19,Billie AI Service Integration Delay,"AXOS infrastructure team enabled Bedrock services in AWS with service accounts created; Pipeline integration testing scheduled for 3/18; Billie data model design review with Marty completed but open questions remain; Billie currently 78% complete with unresolved AI integration issues","Expedite Bedrock pipeline integration testing with dedicated AI/ML engineers; Resolve open questions from Billie data model design review with stakeholder alignment; Conduct Billie AI service end-to-end testing with production-like scenarios; Establish Billie AI monitoring with model performance metrics; Create Billie AI integration documentation and runbooks; Set up Billie AI governance framework for model versioning and deployment","Implement Billie AI fallback mechanisms for service unavailability; Create Billie AI testing strategy with A/B testing capabilities; Conduct Billie AI security and privacy assessment; Establish Billie AI SLA monitoring with alerting; Implement Billie AI audit trail for compliance; Schedule regular Billie AI model performance reviews","AI/ML Engineer, Data Scientist, Integration Architect"
R20,Defect Density Reduction Challenge,"AXOS-1024 defect density reduction through triage and regression expansion required; 51 open bugs (12 High, 39 Medium) with quality gates needing strengthening; RCA/corrective measures being implemented; High defect density and insufficient quality gates allowing escaped defects to reach production","Implement intensive defect triage process with daily prioritization meetings; Strengthen quality gates with mandatory code review, unit testing, and integration testing; Expand regression test suite to cover all critical business flows; Conduct root cause analysis for all High severity defects with corrective action plans; Implement defect prevention techniques with shift-left testing; Create defect metrics dashboard with trend analysis and predictive analytics","Implement automated defect detection tools in CI/CD pipeline; Conduct defect prevention workshops with development teams; Establish defect SLA with resolution time targets by severity; Implement defect prediction models using machine learning; Create defect knowledge base with common patterns and solutions; Schedule regular quality review sessions with stakeholders","QA Lead, Development Lead, Quality Manager"