Risk Title,Risk Desc,Category,Risk Type,Risk Subtype,Severity,Likelihood,Impact,Mitigation Plan,Contingency Plan,Mitigation Status,Risk Org Impact Strategy
"LD Core Engg - Transition - Application Inventory","InComplete coverage of transition plan cannot be ascertained since the application inventory is not available                         External                          Customer         Major    Possible      High","",,Identified
"LD Core Engg - Transition - documentation","Impact on speed of transition due to lack of documentation.                         External                          Customer         Major    Possible      High","",,Identified
"LD Core Engg - Transition - High TAT for clarifications","Delay in transition completion due to high Turn Around Time (TAT) on clarification/questions.                          External                          Customer         Major    Possible      High","",,Identified
"LD Core Engg - Transition - SME knowledge levels","Impact on KT quality due to possibility of  less experienced SME identified as KT provider by the incumbent vendors                         External                          Customer         Major    Possible      High","",,Identified
"LD Core Engg - Transition - SME unavailability","Delay in transition completion due to lack of engagement from incumbent or loanDepot SME                         External                          Customer         Major    Possible      High","",,Identified
"Transition Delay - QE lead","Delay in transition due to non-fulfillment of QE lead for Servicing.                    Organizational                         Resources         Major    Possible      High","Senior QA Analysts in the team to drive the transition. 
Aditya has been identified by Ascendion team as a suitable fit for the lead role in Servicing.",,Identified
"Transition Delay - SDET","Delay in transition due to non-fulfillment of SDET lead for Origination POS                   Organizational                         Resources         Major    Possible      High","Senior SDETs in the team to drive the transition. Relevant SDET lead candidates being lined up for customer discussion.",,Identified
"Closing offshore open positions on time","Offshore open positions closure is very important to avoid those positons getting moved to onshore Project-Level     Organizational                         Resources      Moderate    Unlikely    Medium","All the positions were close on time. This is closed.",,Resolved,Financial Impact Mitigate
"PSA/MSA Renewal","Renew PSA/MSA/SOWs before the expiry date Project-Level           External       External stakeholder groups         Minor    Unlikely       Low","Renewal was done as planned. This is closed now.",,Resolved,Financial Impact Mitigate
"Find temporary replacement of Rujuta","Rujuta is going on her extended maternity leave starting from April 15th till end of November this year. We need to onboard a temporary replacement for her before she leaves.  Project-Level     Organizational                         Resources      Moderate    Possible      High","We hired a temporary replacement for Rujuta so the risk is closed now.",,Resolved,Financial Impact Mitigate
"Onboarding a replacement resource is getting delayed.","We are looking for a replacement resource and the customer wants to onboard a resource in 2 weeks.  It has been 2 weeks already and anytime customer might escalate this issue.   Project-Level     Organizational                         Resources      Moderate    Possible      High","Actively hiring for a replacement",,Assessed,Margin Impact Mitigate
"AWS ticket raised for cloudformation AWS limit for template size","Unknown factors related to AWS limits is affecting and results in deployment failures. Project-Level          Technical                   Software update         Major      Likely Very High","Reported to AWS support team.",we refactored the file and bought the size of the file below the limits of AWS.Deployment sucessfully taken care from Support team,Resolved,Client Relationship Mitigate
"Inadequate Capacity Planning - Insufficient resources","Context:

The actual project start date is 25/8/2025, However sprint 0 is yet to start from Oct 2nd week.

Condition:

Capacity planning is not conducted effectively, leading to underestimation of required resources or failure to allocate them appropriately. This results in insufficient staff, infrastructure, or tools to meet project or operational demands.

Consequence:

Projects may experience delays, quality may be compromised, operational efficiency can decline, and overall business objectives may not be met. This could also lead to cost overruns and reduced stakeholder satisfaction. Project-Level Project Management                          Planning      Moderate        Rare       Low","We are regularly connecting with talent team to identify resources at earliest. 
All open positions for the project have been filled.
Involved senior resources to take interviews and fill the positions as soon as possible.
All open positions for the project have been filled.",Avoid,Client Relationship,Reputation Loss    Avoid
