Risk Title,Risk Desc,Category,Risk Type,Risk Subtype,Severity,Likelihood,Impact,Mitigation Plan,Contingency Plan,Mitigation Status,Risk Org Impact Strategy
"PSA/MSA Renewal","Renew PSA/MSA/SOWs before the expiry date Project-Level           External       External stakeholder groups         Minor    Unlikely       Low","Renewal was done as planned. This is closed now.",,Resolved,Financial Impact Mitigate
"Find temporary replacement of Rujuta","Rujuta is going on her extended maternity leave starting from April 15th till end of November this year. We need to onboard a temporary replacement for her before she leaves.  Project-Level     Organizational                         Resources      Moderate    Possible      High","We hired a temporary replacement for Rujuta so the risk is closed now.",,Resolved,Financial Impact Mitigate
"Onboarding a replacement resource is getting delayed.","We are looking for a replacement resource and the customer wants to onboard a resource in 2 weeks.  It has been 2 weeks already and anytime customer might escalate this issue.   Project-Level     Organizational                         Resources      Moderate    Possible      High","Actively hiring for a replacement",,Assessed,Margin Impact Mitigate
"AWS ticket raised for cloudformation AWS limit for template size","Unknown factors related to AWS limits is affecting and results in deployment failures. Project-Level          Technical                   Software update         Major      Likely Very High","Reported to AWS support team.
we refactored the file and bought the size of the file below the limits of AWS.Deployment sucessfully taken care from Support team",Resolved,Client Relationship Mitigate
"Inadequate Capacity Planning - Insufficient resources","Context:

The actual project start date is 25/8/2025, However sprint 0 is yet to start from Oct 2nd week.

Condition:

Capacity planning is not conducted effectively, leading to underestimation of required resources or failure to allocate them appropriately. This results in insufficient staff, infrastructure, or tools to meet project or operational demands.

Consequence:

Projects may experience delays, quality may be compromised, operational efficiency can decline, and overall business objectives may not be met. This could also lead to cost overruns and reduced stakeholder satisfaction. Project-Level Project Management                          Planning      Moderate        Rare       Low","We are regularly connecting with talent team to identify resources at earliest. 
All open positions for the project have been filled. Involved senior resources to take interviews and fill the positions as soon as possible.
All open positions for the project have been filled.",Avoid,Client Relationship,Reputation Loss    Avoid
"ADO hygiene","Context:
Azure DevOps (ADO) is used as the project dashboard where all features, user stories, tasks, and pull requests (PRs) are tracked. As per the defined process, PRs must be linked at the User Story level to ensure proper traceability and reporting.

Condition:
The team did not consistently maintain the required linking structure.

PRs were linked to tasks instead of user stories.

Proper links were also missing at the feature and user story levels.

Consequence:

Reduced traceability between code changes and user stories.

Incomplete updates visible in the ADO dashboard.

Gaps in reporting shared with the client.

Potential impact on client communication and relationship due to missing or unclear status updates. Project-Level Project Management                          Planning      Moderate    Unlikely    Medium","Created a list of Do’s and Don’ts for Azure DevOps (ADO) to ensure proper usage of the dashboard.

Conducted a knowledge-sharing session with the team to educate them on correct ADO practices, including proper linking of features, user stories, tasks, and pull requests (PRs).

Highlighted the importance of linking PRs at the User Story level instead of tasks to maintain proper traceability.

Defined and shared action items for improving ADO hygiene, including regular checks and adherence to the linking standards.",Identified,Client Relationship Mitigate
