Risk Title,Risk Desc,Category,Risk Type,Risk Subtype,Severity,Likelihood,Impact,Mitigation Plan,Contingency Plan,Mitigation Status,Risk Org Impact Strategy
Apigee Access exposure of new service,Apigee access need to be created for the new service within 30th of March for the April Delivery,External,Suppliers,Major,Possible,High,Necessary process has been planned out and details documented & approved,Process initiated, also a plan has been worked out to utilize the existing key exchanged method for availing the service,Identified,,
Unclear or evolving project requirements,Unclear or evolving project requirements - Context: Results from ambiguous or frequently changing specifications during the project lifecycle. Condition: Driven by shifting stakeholder expectations lack of clear objectives or ineffective communication. Consequence: Causes rework delays increased costs and challenges in delivering a successful project outcome,Project-Level,External,Customer,Severe,Very Likely,Very High,We are discussing with client for clear requirements.,We set-up daily call with client to discuss and get the requirements on priority,Identified,Client Relationship,Financial Impact Mitigate
Skill gaps within the project team,Skill gaps within the project team - Context: Occurs when team members lack expertise in critical areas. Condition: Includes failure to identify skill gaps limited training opportunities or mismatch between required and available skills. Consequence: Leads to errors reliance on external consultants and challenges in meeting project requirements,Project-Level,Organizational,Resources,Severe,Very Likely,Very High,We Identified new senior resources from circle team to bring back the project on to the track,We setup daily Sync-up call with circle team to guide our team members. We added new resources to speed up the delivery process,Identified,Financial Impact,Client Relationship Mitigate
Cognixia resource ramp down,Miguel contract date to be extended from 8/12 to 8/30 thru Cognixia or take another .net resource from Cognixia,Organizational,Resources,Moderate,Possible,High,Miguel contract date to be extended from 8/12 to 8/30 thru Cognixia or take another .net resource from Cognixia,Identified,,
NFR are not documented,Non functional requirements are not doccumented,Project-Level,Project Management,Governance,Minor,Possible,Medium,Have reported this to the client and have asked to maintain the same,Identified,Reputation Loss Mitigate
Gap in Contractual commitments,Scope mismatch between the one mentioned in SOW vs the actual work done (automation, Stress test etc.) 2. Clauses in the SOW not adhered / tracked in MBR. Miss in Contractual aspects might lead to contractual obligations and may lead to ambiguities w.r.t deliverables, roles, and responsibilities of the resource, amount payable etc.,Project-Level,Project Management,Communication,Major,Possible,High,To Correct the SOW,To Correct the SOW,Client Relationship Mitigate
Jira tool usage,Requirement tool is JIRA, However not all User Stories / Tasks created in JIRA assigned to team. There is a gap in requirement gathering and tracking. This may lead to product backlog, spill overs, etc.,Project-Level,Project Management,Execution,Minor,Possible,Medium,The client has been informed about this,The client has been informed about this,Identified,Reputation Loss   Accept
Static code analysis in CI/CD pipeline,1.SonarQube output is 65% which is a risk and need to fix the leakages in the code quality immediately. Risk should be reported in status reports for transparency even though client is fine with this approach. 2. During audit, it is noticed that SonarQube is not integrated into pipeline for immigration track. Team should analyse and fix the gap at the earliest.,Project-Level,Technical,Audit requirement changes,Minor,Unlikely,Low,The client has been informed about this,The client has been informed about this,Identified,Reputation Loss Mitigate
Unit tezting,Noticed partial unit testing only happening in the project. In case of any requirement change, related UTCs are not updated and tracked.  This will lead to inadequate test coverage and incomplete validations and will result in defect leakages to further stages. Risk should be reported in status reports for transparency even though client is fine with this approach.,Project-Level,Technical,Audit requirement changes,Minor,Unlikely,Low,The client has been informed about this,The client has been informed about this,Identified,Reputation Loss Mitigate
Release notes,Presently no release notes are maintained.,Project-Level,Project Management,Governance,Minor,Rare,Low,The client has been maintaining the release notes now,The client has been maintaining the release notes now,Resolved,Reputation Loss   Accept
Inadequate unit testing,Partial unit testing is observed in the project. In case of any requirement change related unit test cases are not updated and tracked. This will result in inadequate test coverage and incomplete validations leading to defect leakages to further stages. It is recommended to report this risk in status reports for transparency even though the client is fine with the current approach.,Project-Level,Technical,Software update,Moderate,Possible,High,The client has been informed about the same and has to take appropriate action,The client has been informed about the same and has to take appropriate action,Reputation Loss   Accept
Inadequate unit testing,Partial unit testing is observed in the project. In case of any requirement change related unit test cases are not updated and tracked. This will result in inadequate test coverage and incomplete validations leading to defect leakages to further stages. It is recommended to report this risk in status reports for transparency even though the client is fine with the current approach.,Project-Level,Technical,Software update,Moderate,Possible,High,The client has been informed about the same and has to take appropriate action,The client has been informed about the same and has to take appropriate action,Reputation Loss   Accept
1 open PMO role need to be filled-1,1 resource BGV failed and need to find a replacement.,Organizational,Resources,Major,Possible,High,Working with HR team to fill the open role,Resolved,Financial Impact Mitigate
Delay in Onboarding the resource & Citi access. Dhivya identified as a replacement for Anto,Dhivya Bharathi  identified as a replacement for Anto. Her Citi BGV check started on 22-Feb-2023. BGV need to be completed on/before 20 working days.,Organizational,Resources,Major,Possible,High,Working with BGV Team to speed up the process. Once BGV completed we will raise the Citi access request immediately,Resolved,Financial Impact Mitigate
Delivery -Vibhas CITI access request not raised yet.  Delay in completing the Onboarding.-1,Vibhas Citi access request not raised yet,Technical,Connectivity and access,Major,Possible,High,Following up with Citi to get an approval & immediately will inform Reema to initiate the mobile token & Temp password request once we get an approval. All issues resloved,Resolved,Financial Impact Mitigate
