risk_id,risk_type,detected_indicators,mitigation,suggestions,owner
R001,QA Budget Overrun,"Budget exceeded by ₹25,000;Increased retesting cycles;Multiple defect reopens (2-3 cycles);PR approval delays causing extended QA effort","Implement defect root cause analysis process;Establish PR approval SLA with escalation path;Optimize test case design to reduce retesting;Implement budget tracking dashboard with weekly reviews","Conduct retrospective to identify defect patterns;Implement automated regression testing to reduce manual effort;Establish defect prevention metrics and quality gates;Provide training on first-time-right testing practices",QA Lead
R002,PR Approval Delays,"Consistent PR approval delays across all sprints;Bug fixes blocked awaiting architecture review;Cycle time increases documented;Delivery timeline slippage observed","Establish PR review SLA (24-48 hours);Implement automated PR checks and code quality gates;Assign backup reviewers for architecture team;Create PR prioritization framework based on criticality","Implement pair programming for critical changes;Conduct architecture review training for senior developers;Set up PR dashboard with aging metrics and alerts;Schedule dedicated PR review time blocks daily",Development Manager
R003,Medium Defect Leakage,"Medium defects leaked across Sprints 1-8;Reopen counts ranging 0-2 per defect;Multiple retesting cycles required;Incomplete fixes indicating quality gaps","Implement mandatory root cause analysis for all reopened defects;Enhance test coverage with boundary and negative scenarios;Establish definition of done checklist with verification steps;Conduct peer review of defect fixes before QA handoff","Implement defect clustering analysis to identify problem areas;Provide targeted training on common defect patterns;Establish quality metrics dashboard with trend analysis;Conduct monthly quality review meetings with lessons learned",QA Manager
R004,Environment Access Dependency,"Multiple tasks blocked due to UAT/prod access issues;Continuous follow-ups required for permissions;Approval delays impacting validation timelines;Dependency tracking overhead across Sprints 1-8","Implement self-service access request portal with automated approvals;Pre-provision environment access at sprint planning;Establish access approval SLA with escalation matrix;Create environment access runbook with clear procedures","Implement role-based access control (RBAC) framework;Conduct quarterly access review and cleanup;Establish backup access contacts for critical environments;Provide access management training to project teams",DevOps Lead
R005,DevOps Budget Overrun,"Budget exceeded by ₹20,000;Increased production monitoring activities;Integration validation requiring more effort than planned;Log analysis overhead","Implement automated monitoring and alerting to reduce manual effort;Optimize log aggregation and analysis tools;Right-size monitoring scope based on risk assessment;Establish budget tracking with weekly variance analysis","Implement AIOps for intelligent log analysis;Conduct capacity planning review for monitoring infrastructure;Establish monitoring efficiency metrics;Provide training on efficient troubleshooting techniques",DevOps Manager
R006,Developer Over-Utilization,"Developer utilization at 82% vs planned 70%;Sustained high workload across Q1 2026;Increased bug fixes and PR rework;QA support overhead;Burnout risk indicators present","Redistribute workload across team members;Implement mandatory time-off policy;Reduce non-critical meetings and interruptions;Bring in additional development resources or contractors","Conduct workload analysis and capacity planning;Implement developer wellness program;Establish work-from-home flexibility;Provide training on time management and prioritization;Monitor velocity trends for early burnout detection",Engineering Manager
R007,QA Over-Utilization,"QA utilization at 24% vs planned 20%;Increased retesting cycles due to defect reopens;Regression testing overhead;Workload beyond planned capacity","Implement test automation to reduce manual testing effort;Optimize test case prioritization and risk-based testing;Bring in additional QA resources for peak periods;Reduce retesting through better defect fix quality","Conduct test efficiency analysis;Implement shift-left testing practices;Provide training on test automation tools;Establish QA capacity planning model with buffer",QA Manager
R008,Integration Dependency Delays,"Integration validation delayed in Sprints 2-8;Environment access dependencies blocking progress;Data flow validation issues;External system readiness delays","Implement integration dependency tracking dashboard;Establish integration readiness checklist with pre-validation;Create mock services for independent testing;Schedule integration windows with stakeholder commitment","Conduct integration architecture review;Implement contract testing for API dependencies;Establish integration test environment with production-like data;Create integration runbook with troubleshooting guide",Integration Lead
R009,Production Monitoring Overhead,"Increased monitoring activities during cutover and hypercare;Log validation requiring sustained effort;Exception alerts requiring investigation;Retry behavior monitoring overhead","Implement automated log analysis and anomaly detection;Establish alert prioritization and escalation framework;Create production monitoring playbook with response procedures;Optimize monitoring scope to focus on critical metrics","Implement observability platform with unified dashboards;Conduct production readiness review with monitoring checklist;Establish on-call rotation with clear responsibilities;Provide training on production troubleshooting",Production Support Lead
R010,UAT Signoff Delays,"UAT support blocked by client signoff delays in Sprint 6;Defect retest queue impacting progress;Compliance evidence pending;Sign-off readiness impacted by approval workflows","Establish UAT signoff SLA with client stakeholders;Implement parallel defect resolution and UAT activities;Create compliance evidence repository with automated collection;Conduct weekly UAT status meetings with client","Implement UAT automation for regression scenarios;Create UAT signoff checklist with clear criteria;Establish escalation path for delayed approvals;Provide UAT training to client users",Project Manager
R011,Cutover Checklist Approval Delays,"Cutover rehearsal blocked by checklist approval in Sprint 7;Interface freeze confirmation delayed;Production readiness validation pending approvals;Dependency coordination overhead","Implement cutover checklist automation with approval workflow;Establish cutover approval SLA with escalation;Conduct cutover readiness review 2 weeks before go-live;Create cutover runbook with detailed steps and rollback procedures","Conduct cutover simulation with all stakeholders;Implement cutover dashboard with real-time status;Establish war room for cutover execution;Create post-cutover validation checklist",Release Manager
R012,Sustained Dependency Management Issues,"Continuous dependency tracking required across Sprints 1-8;Multiple blocked tasks due to external dependencies;Access permissions causing delays;PR approvals impacting flow;External system readiness issues","Implement dependency management tool with automated tracking;Establish dependency resolution SLA with owners;Create dependency risk register with mitigation plans;Conduct weekly dependency review meetings","Implement dependency mapping at project initiation;Establish dependency early warning system;Create dependency escalation matrix;Provide training on dependency management best practices",Project Manager
R013,Project Health Degradation,"Project health degraded from Green to Amber in Weeks 6-8;PR approval delays contributing to risk;Access dependencies increasing;Production validation issues emerging","Conduct root cause analysis of health degradation factors;Implement corrective action plan with timeline;Increase stakeholder communication frequency;Establish risk mitigation task force","Implement project health dashboard with leading indicators;Conduct weekly risk review with executive sponsor;Establish early warning metrics for health degradation;Create project recovery playbook",Project Manager
R014,Mid-Sprint Resource Addition,"Divya joined mid-sprint in Sprint 4;Knowledge transfer required for QA automation;Defect revalidation handover needed;Ramp-up time impacting sprint velocity","Implement structured onboarding program with checklist;Assign buddy for knowledge transfer;Provide access to documentation and training materials;Reduce initial workload to allow ramp-up time","Create role-specific onboarding guides;Implement knowledge management system;Conduct regular check-ins during ramp-up period;Establish onboarding success metrics",QA Manager
R015,Leave Coverage and Backup Support,"Multiple team members took leave in Sprints 3-5;Planned leave, sick leave, and flexi holidays requiring coverage;Backup coordination needed;Handover overhead for continuity","Implement leave planning calendar with advance notice;Establish backup coverage matrix for all roles;Create knowledge transfer templates for handovers;Maintain cross-training program for critical skills","Implement leave approval workflow with capacity check;Create role-specific backup documentation;Establish minimum team capacity thresholds;Conduct regular cross-training sessions",Resource Manager
R016,Development Cost Efficiency,"Development costs on track at ₹11,60,000 vs ₹12,00,000 budget;Efficient handling of PR delays maintained cost control;Bug fixes managed within budget;No cost overrun despite challenges","Continue current cost control practices;Maintain budget tracking dashboard;Conduct monthly budget reviews;Document cost efficiency best practices for replication","Implement cost optimization initiatives;Establish cost efficiency metrics and benchmarks;Recognize team for cost management success;Share best practices across organization",Finance Manager
R017,Hypercare Stabilization and Handover,"Bala rolled off after hypercare completion in Sprint 8;Support transition to operations coverage;Knowledge transfer required;Handover documentation needed","Implement structured handover process with checklist;Create comprehensive support documentation;Conduct knowledge transfer sessions with operations team;Establish support escalation path with SME availability","Create hypercare runbook with common issues and resolutions;Implement support knowledge base;Establish post-handover support period with SME on-call;Conduct handover effectiveness review after 30 days",Operations Manager
R018,Production Exception and Retry Management,"Production queue monitoring required continuous attention in Sprints 7-8;Exception alerts requiring investigation;Retry behavior monitoring during cutover and hypercare;Operational overhead increased","Implement automated exception handling and retry logic;Establish exception alert prioritization framework;Create production monitoring dashboard with real-time metrics;Optimize retry configuration based on error patterns","Implement self-healing mechanisms for common exceptions;Conduct exception pattern analysis for prevention;Establish production support runbook;Provide training on exception troubleshooting",Production Support Lead
R019,High Defect Reopen Rate,"Defects required 2-3 retesting cycles across Sprints 1-8;Reopen counts ranging 0-2 per defect;Incomplete fixes indicating quality issues;Insufficient root cause analysis","Implement mandatory root cause analysis for all defects;Establish defect fix verification checklist;Conduct peer review of fixes before QA submission;Implement defect metrics dashboard with reopen rate tracking","Provide training on effective defect resolution;Implement defect prevention techniques;Conduct defect causal analysis workshops;Establish quality improvement initiatives based on defect patterns",Development Manager
R020,Positive ROI Achievement,"Project achieved 128% ROI with high delivery value;Cost efficiency maintained despite QA and DevOps overruns;Strong delivery outcome aligned with business goals;Positive business value demonstrated","Document success factors and best practices;Conduct lessons learned session;Share success story across organization;Recognize team contributions to ROI achievement","Establish ROI tracking for future projects;Create ROI improvement framework;Implement value realization tracking;Conduct ROI benchmarking against industry standards",Program Manager"