risk_id,risk_type,detected_indicators,mitigation,suggestions,owner
R01,Inefficient partitioning leading to full table scans and high latency.,"Query performance degradation;High cluster utilization;Excessive data scanning;Long-running queries","Implement proper partitioning strategy using Delta Lake partition columns;Enable adaptive query execution;Use Z-ordering for frequently queried columns;Implement table statistics collection","Conduct regular query performance audits;Implement partition pruning best practices;Use Databricks SQL Analytics for query optimization;Train team on partition design patterns",Data Engineer
R02,Improper use of Multi-Cluster Warehouses leading to queueing.,"Query queuing alerts;High warehouse load;User complaints about slow response;Warehouse scaling events","Configure appropriate scaling policy (Standard vs Economy);Set proper min/max cluster counts;Implement query prioritization;Enable query acceleration service","Monitor warehouse load patterns;Implement workload management policies;Use resource monitors for cost control;Schedule heavy workloads during off-peak hours",DevOps Engineer
R03,Failure to implement Medallion Architecture (Bronze/Silver/Gold) leading to data swamp.,"Unstructured data proliferation;Lack of data lineage;Difficulty in data discovery;Inconsistent data quality","Implement Bronze layer for raw data ingestion;Create Silver layer for cleaned and conformed data;Establish Gold layer for business-level aggregates;Document data flow and transformations","Establish data governance framework;Implement data quality checks at each layer;Use Unity Catalog for metadata management;Create data architecture standards documentation",Data Architect
R04,Cloud egress costs exceeding budget due to cross-region data movement.,"Unexpected cloud bills;High network transfer costs;Cross-region data transfer logs;Budget alerts triggered","Implement data locality strategy;Use same-region storage and compute;Enable data replication only when necessary;Optimize data transfer patterns","Conduct regular cost analysis;Implement data residency policies;Use cloud cost management tools;Negotiate enterprise agreements with cloud providers",Cloud Architect
R05,Over-reliance on Snowflake-specific SQL preventing future portability.,"Extensive use of proprietary functions;Tight coupling to Snowflake features;Lack of abstraction layers;Migration difficulty assessments","Use ANSI SQL standards where possible;Abstract platform-specific code into separate modules;Document Snowflake-specific dependencies;Create portability guidelines","Implement database abstraction layer;Maintain compatibility matrix;Conduct periodic portability assessments;Train team on SQL standards",Database Architect
R06,Misconfiguration of Unity Catalog leading to broken lineage.,"Missing lineage information;Data discovery failures;Broken metadata relationships;Governance audit failures","Properly configure Unity Catalog metastore;Implement correct catalog hierarchy;Enable automatic lineage capture;Validate metadata consistency","Conduct regular Unity Catalog audits;Implement governance policies;Train team on Unity Catalog best practices;Use Databricks Asset Bundles for deployment",Data Governance Lead
R07,Small File Problem: Excessive tiny files degrading Spark performance.,"Slow query performance;High task overhead;Excessive file listing operations;Memory pressure on driver","Implement file compaction strategy;Use Auto Optimize for Delta tables;Configure appropriate file size targets;Enable bin-packing during writes","Schedule regular OPTIMIZE operations;Monitor file size distributions;Implement streaming aggregation;Use Delta Lake liquid clustering",Data Engineer
R08,Cold start latency for high-concurrency BI workloads.,"Slow initial query response;User experience complaints;High p95/p99 latencies;Dashboard load delays","Use Databricks SQL Serverless warehouses;Implement query result caching;Enable Photon acceleration;Pre-warm clusters for critical workloads","Implement connection pooling;Use materialized views for common queries;Schedule cache warming jobs;Monitor and optimize query patterns",BI Engineer
R09,Integration failure between Snowpipe and cloud storage (S3/ADLS) notifications.,"Data ingestion delays;Missing event notifications;Snowpipe error logs;Data freshness SLA breaches","Verify cloud storage event notification configuration;Validate IAM/SAS permissions;Test Snowpipe connectivity;Implement retry mechanisms","Set up monitoring for Snowpipe status;Implement alerting for ingestion failures;Document integration architecture;Conduct regular integration tests",Data Engineer
R10,Metadata overhead in Delta Lake due to lack of VACUUM and OPTIMIZE.,"Growing storage costs;Slow metadata operations;Transaction log bloat;Performance degradation","Schedule regular VACUUM operations;Implement OPTIMIZE with Z-ordering;Configure appropriate retention periods;Monitor transaction log size","Automate maintenance operations;Implement data lifecycle policies;Monitor storage metrics;Train team on Delta Lake maintenance",Data Engineer
R11,Incompatibility between Private Link/VPC Peering and external SaaS tools.,"Connection failures to external tools;Network routing issues;Integration test failures;Service unavailability","Implement proper network architecture;Configure DNS resolution correctly;Use appropriate connectivity method (PrivateLink/VPC peering);Test all integration points","Document network architecture;Maintain connectivity matrix;Implement network monitoring;Coordinate with security team on network policies",Network Engineer
R12,Failure of Zero-Copy Cloning to maintain consistency during production patches.,"Data inconsistency between environments;Clone synchronization issues;Unexpected data drift;Deployment failures","Implement proper clone refresh strategy;Validate clone consistency before deployment;Use Time Travel for point-in-time clones;Document clone dependencies","Automate clone refresh processes;Implement validation checks;Use CI/CD for deployment automation;Monitor clone staleness",DevOps Engineer
R13,Latency in Search Optimization Service for point-lookup queries.,"Slow point query performance;High query latency;Search optimization service not engaged;User complaints","Enable Search Optimization Service on appropriate tables;Configure proper search access paths;Monitor service effectiveness;Optimize query patterns","Analyze query patterns for optimization candidates;Monitor search optimization costs;Implement query result caching;Train team on search optimization usage",Database Administrator
R14,Version mismatch between Databricks Runtime (DBR) and Python/Scala libraries.,"Library compatibility errors;Job failures;Unexpected behavior;Dependency conflicts","Use DBR-compatible library versions;Implement dependency management;Test library compatibility;Document supported versions","Maintain library compatibility matrix;Implement automated testing;Use cluster policies for version control;Establish upgrade procedures",Platform Engineer
R15,Data fragmentation in Hybrid Tables (Unistore) affecting transactional speed.,"Slow transactional queries;High latency for OLTP workloads;Performance degradation;Lock contention","Implement proper indexing strategy;Optimize table design for hybrid workloads;Monitor fragmentation levels;Schedule maintenance operations","Conduct workload analysis;Implement appropriate data models;Monitor transaction performance;Consider workload separation if needed",Database Architect
R16,Underutilization of Liquid Clustering leading to manual Z-Order overhead.,"Manual clustering operations;High maintenance overhead;Suboptimal query performance;Operational burden","Enable Liquid Clustering for appropriate tables;Configure clustering columns based on query patterns;Automate clustering maintenance;Monitor clustering effectiveness","Analyze query patterns for clustering candidates;Migrate from Z-Order to Liquid Clustering;Monitor clustering metrics;Train team on Liquid Clustering benefits",Data Engineer
R17,Failure of Dynamic Tables to refresh within the target SLA window.,"Stale data in downstream tables;SLA breaches;Refresh failures;Data freshness complaints","Optimize source query performance;Configure appropriate refresh schedules;Monitor refresh duration;Implement incremental refresh patterns","Set up refresh monitoring and alerting;Analyze refresh bottlenecks;Implement data quality checks;Document refresh dependencies",Data Engineer
R18,Inconsistent schema evolution handling in Auto Loader.,"Schema mismatch errors;Data ingestion failures;Missing columns;Type conversion issues","Configure schema evolution mode appropriately;Implement schema validation;Use schema hints for complex types;Monitor schema changes","Implement schema registry;Document schema evolution policies;Set up schema change alerts;Test schema evolution scenarios",Data Engineer
R19,API rate limiting during high-frequency metadata calls.,"API throttling errors;Failed automation jobs;Slow metadata operations;Service degradation","Implement rate limiting handling;Use exponential backoff;Batch API calls where possible;Optimize API usage patterns","Monitor API usage metrics;Implement caching for metadata;Request rate limit increases if justified;Optimize automation workflows",Platform Engineer
R20,Data Silos: Snowflake and Databricks co-existing without a unified catalog.,"Duplicate data definitions;Inconsistent metadata;Difficult data discovery;Governance challenges","Implement unified metadata management;Use data catalog tools;Establish data governance framework;Create cross-platform lineage","Evaluate unified catalog solutions;Implement data mesh architecture;Establish data ownership policies;Create centralized data documentation",Data Governance Lead
R21,Runaway queries consuming excessive Credits/DBUs without auto-termination.,"Unexpected cost spikes;Long-running queries;Resource exhaustion;Budget overruns","Implement query timeout policies;Configure resource monitors;Set up cost alerts;Enable automatic query termination","Monitor query execution patterns;Implement query governance;Train users on efficient query writing;Establish query review process",Database Administrator
R22,Mismanagement of Snowflake Resource Monitors leading to unexpected downtime.,"Service interruptions;Warehouse suspension;User access issues;Business impact","Configure resource monitors with appropriate thresholds;Implement graduated alerting;Set up notification chains;Document escalation procedures","Monitor credit consumption trends;Implement predictive alerting;Establish cost governance policies;Conduct regular cost reviews",FinOps Manager
R23,Over-provisioning of Cluster sizes (e.g. 4XL) for small transformation jobs.,"High compute costs;Underutilized resources;Inefficient resource allocation;Budget waste","Right-size clusters based on workload requirements;Implement cluster policies;Use job clusters for batch workloads;Monitor cluster utilization","Conduct regular resource utilization reviews;Implement automated rightsizing recommendations;Use spot instances for non-critical workloads;Train team on cost optimization",Cloud Architect
R24,High Cloud Services layer costs due to excessive metadata operations (DDL/DML).,"Unexpected cloud services charges;High metadata operation volume;Cost anomalies;Budget overruns","Optimize metadata operations;Batch DDL/DML operations;Reduce unnecessary schema changes;Monitor cloud services usage","Analyze metadata operation patterns;Implement metadata operation governance;Use automation to reduce manual operations;Review and optimize data architecture",Database Administrator
R25,Photon Engine enabled for non-vectorized workloads increasing costs.,"Higher DBU consumption;No performance improvement;Cost increase without benefit;Inefficient resource usage","Evaluate workload suitability for Photon;Disable Photon for incompatible workloads;Monitor Photon effectiveness;Implement workload-specific cluster policies","Conduct workload analysis;Implement cost-benefit analysis for Photon;Monitor performance metrics;Train team on Photon use cases",Performance Engineer
R26,Storage costs escalating due to excessive Time Travel retention (e.g. 90 days).,"Growing storage costs;Unnecessary data retention;Storage capacity issues;Budget impact","Configure appropriate Time Travel retention periods;Implement data lifecycle policies;Balance compliance requirements with cost;Monitor storage growth","Conduct data retention policy review;Implement automated data archival;Monitor storage costs;Document retention requirements",Data Governance Lead
R27,Idle clusters remaining active due to long Auto-Terminate settings.,"Wasted compute resources;High idle costs;Underutilized clusters;Budget inefficiency","Configure aggressive auto-termination policies;Set appropriate idle timeouts;Monitor cluster activity;Implement cluster usage policies","Analyze cluster usage patterns;Implement automated cluster management;Set up idle resource alerts;Train users on cluster lifecycle",DevOps Engineer
R28,Failure to utilize Serverless SQL Warehouses leading to underutilized compute.,"Inefficient resource utilization;Higher costs;Slow scaling;Operational overhead","Migrate appropriate workloads to Serverless;Evaluate serverless benefits;Implement serverless-first policy;Monitor serverless adoption","Conduct workload assessment for serverless migration;Implement gradual migration strategy;Monitor cost and performance improvements;Train team on serverless capabilities",Platform Architect
R29,Unexpected costs from External Functions calling expensive 3rd party APIs.,"High API costs;Unexpected charges;Budget overruns;Cost attribution challenges","Implement API call monitoring;Set up cost controls;Optimize API usage patterns;Consider caching strategies","Negotiate API pricing;Implement rate limiting;Monitor API usage and costs;Document API cost implications",Integration Engineer
R30,Budget overrun due to lack of Tagging for cost attribution by department.,"Inability to track costs by department;Budget allocation challenges;Cost accountability issues;Financial reporting difficulties","Implement comprehensive tagging strategy;Enforce tag policies;Automate tag application;Generate cost reports by tags","Establish tagging standards;Implement tag governance;Use cloud cost management tools;Conduct regular cost attribution reviews",FinOps Manager
R31,High cost of data egress when using Delta Sharing with non-Databricks clients.,"Unexpected egress charges;High data transfer costs;Budget impact;Cost attribution challenges","Optimize Delta Sharing usage;Consider alternative data sharing methods;Monitor egress costs;Implement data sharing governance","Analyze data sharing patterns;Negotiate egress pricing;Implement data sharing best practices;Document cost implications",Data Architect
R32,Credits wasted on frequent manual RECLUSTER operations.,"High compute costs;Unnecessary clustering operations;Operational inefficiency;Budget waste","Implement Automatic Clustering;Optimize clustering key selection;Monitor clustering effectiveness;Reduce manual interventions","Analyze clustering patterns;Automate clustering operations;Monitor clustering costs vs benefits;Train team on clustering best practices",Database Administrator
R33,Underestimating costs of Materialized View maintenance.,"Higher than expected costs;Performance impact;Resource contention;Budget overruns","Evaluate materialized view necessity;Optimize refresh strategies;Monitor maintenance costs;Consider alternative approaches","Conduct cost-benefit analysis;Implement selective materialization;Monitor refresh performance;Document materialized view strategy",Data Architect
R34,High DBU consumption for small frequent streaming micro-batches.,"Inefficient resource usage;High streaming costs;Suboptimal batch sizes;Budget impact","Optimize batch sizes for streaming;Implement adaptive batch sizing;Use structured streaming efficiently;Monitor streaming costs","Analyze streaming patterns;Implement cost-effective streaming architecture;Monitor DBU consumption;Train team on streaming optimization",Streaming Engineer
R35,Inefficient use of Snowflake Marketplace (buying data with high compute overhead).,"High compute costs for marketplace data;Inefficient data usage;Budget impact;ROI concerns","Evaluate marketplace data value;Optimize data processing;Consider data sampling;Monitor usage and costs","Conduct ROI analysis for marketplace data;Implement data usage governance;Monitor costs vs value;Document marketplace data strategy",Data Product Manager
R36,Lack of spot instance utilization for non-critical Databricks jobs.,"Higher compute costs;Missed cost savings opportunities;Inefficient resource allocation;Budget inefficiency","Enable spot instances for appropriate workloads;Implement spot instance policies;Handle spot interruptions gracefully;Monitor spot usage","Identify spot-compatible workloads;Implement spot instance automation;Monitor cost savings;Train team on spot instance usage",Cloud Architect
R37,Query Profile reveals high Data Spilling to local/remote disk.,"Performance degradation;High query latency;Resource contention;Memory pressure","Optimize query memory usage;Increase warehouse size if justified;Optimize query logic;Reduce data volumes processed","Analyze query patterns;Implement query optimization best practices;Monitor memory usage;Train team on query optimization",Performance Engineer
R38,Overlapping schedules of heavy ETL jobs causing peak-shaving failures.,"Resource contention;Job failures;Performance degradation;SLA breaches","Implement job scheduling optimization;Stagger heavy workloads;Use workload management;Monitor resource utilization","Analyze job dependencies;Implement intelligent scheduling;Use orchestration tools effectively;Monitor job performance",Data Engineer
R39,Failure to monitor Warehouse Load Monitoring charts.,"Missed performance issues;Suboptimal resource allocation;Capacity planning challenges;Reactive problem solving","Implement proactive monitoring;Set up load monitoring dashboards;Configure alerting;Review metrics regularly","Establish monitoring best practices;Implement automated alerting;Conduct regular performance reviews;Train team on monitoring tools",Database Administrator
R40,Complex pricing models making ROI calculation difficult for stakeholders.,"Difficulty justifying costs;Budget approval challenges;Stakeholder confusion;Financial planning difficulties","Simplify cost reporting;Create clear cost attribution;Implement chargeback models;Provide regular cost transparency","Develop cost education materials;Implement FinOps practices;Create cost dashboards for stakeholders;Conduct regular cost reviews",FinOps Manager
R41,Schema Drift: Upstream changes breaking downstream Delta Tables.,"Pipeline failures;Data quality issues;Schema mismatch errors;Downstream impact","Implement schema validation;Use schema evolution carefully;Monitor schema changes;Implement change management","Establish schema governance;Implement schema registry;Set up schema change alerts;Test schema changes thoroughly",Data Engineer
R42,Silent failures in Streamlit apps embedded within Snowflake.,"Undetected application errors;User experience issues;Data quality problems;Lack of visibility","Implement comprehensive error handling;Add logging and monitoring;Set up alerting;Test error scenarios","Establish application monitoring;Implement health checks;Create error dashboards;Train team on debugging",Application Developer
R43,Data duplication due to lack of Idempotency in Spark pipelines.,"Duplicate records;Data quality issues;Incorrect aggregations;Business impact","Implement idempotent operations;Use merge operations;Implement deduplication logic;Add data quality checks","Design pipelines for idempotency;Implement exactly-once semantics;Monitor data quality;Test failure scenarios",Data Engineer
R44,Failure of Data Quality Monitors (e.g. Great Expectations) to trigger alerts.,"Undetected data quality issues;Silent failures;Downstream impact;Trust erosion","Verify monitoring configuration;Test alerting mechanisms;Implement redundant checks;Monitor monitor health","Establish data quality framework;Implement comprehensive testing;Create escalation procedures;Train team on data quality tools",Data Quality Engineer
R45,Stale data in the Gold layer due to failed Orchestration (Airflow/MWAA).,"Data freshness issues;SLA breaches;Business impact;User complaints","Implement robust orchestration;Add failure handling;Set up monitoring and alerting;Implement retry mechanisms","Establish orchestration best practices;Implement comprehensive monitoring;Create runbooks for failures;Train team on orchestration tools",Data Engineer
R46,Concurrency conflicts in Delta Lake (ConcurrentAppendException).,"Write failures;Job retries;Performance degradation;Data consistency issues","Implement optimistic concurrency control;Use appropriate isolation levels;Optimize write patterns;Monitor conflict rates","Design for concurrent writes;Implement retry logic;Monitor Delta Lake metrics;Train team on concurrency handling",Data Engineer
R47,Missing Data: Incomplete ingestion from Snowpipe due to file format errors.,"Data completeness issues;Ingestion failures;File parsing errors;Business impact","Implement file validation;Add error handling;Monitor ingestion status;Set up alerting","Establish data ingestion standards;Implement comprehensive validation;Create error handling procedures;Monitor data completeness",Data Engineer
R48,Precision loss during Variant to Relational flattening.,"Data accuracy issues;Precision errors;Calculation discrepancies;Business impact","Use appropriate data types;Implement precision preservation;Validate transformations;Document precision requirements","Establish data type standards;Implement validation checks;Test precision scenarios;Train team on data type handling",Data Engineer
R49,Inconsistent UDF (User Defined Function) logic between Dev and Prod.,"Different results across environments;Production issues;Testing challenges;Deployment failures","Implement version control for UDFs;Use CI/CD for deployment;Test thoroughly;Maintain environment parity","Establish UDF development standards;Implement automated testing;Use deployment automation;Document UDF logic",Data Engineer
R50,Failure to manage Bad Records path in Spark leading to lost data.,"Data loss;Incomplete processing;Silent failures;Business impact","Configure bad records path;Implement error handling;Monitor bad records;Set up alerting","Establish error handling standards;Implement comprehensive monitoring;Create recovery procedures;Train team on error handling",Data Engineer
R51,Inaccurate results from Snowpark-optimized Python code vs SQL.,"Result discrepancies;Business impact;Trust issues;Validation failures","Implement thorough testing;Validate results;Document differences;Use appropriate optimization","Establish testing standards;Implement result validation;Monitor accuracy;Train team on Snowpark optimization",Data Engineer
R52,Broken lineage in Databricks SQL due to manual table overrides.,"Lost lineage information;Governance issues;Compliance challenges;Data discovery problems","Avoid manual overrides;Use proper DDL operations;Maintain lineage integrity;Document changes","Establish governance policies;Implement lineage monitoring;Create change management procedures;Train team on lineage importance",Data Governance Lead
R53,Data corruption in External Tables hosted on low-durability storage.,"Data integrity issues;Inconsistent results;Business impact;Trust erosion","Use appropriate storage tiers;Implement data validation;Monitor data integrity;Use checksums","Establish storage standards;Implement data protection;Monitor storage health;Document storage requirements",Data Architect
R54,Divergence between Streaming and Batch data results (Lambda failure).,"Result inconsistencies;Business confusion;Trust issues;Reconciliation challenges","Implement Kappa architecture;Ensure processing consistency;Validate results;Monitor divergence","Establish architecture standards;Implement result validation;Monitor consistency;Train team on streaming vs batch",Data Architect
R55,Failure to implement Constraints (Check/PK/FK) leading to referential gaps.,"Data integrity issues;Referential integrity violations;Data quality problems;Business impact","Implement appropriate constraints;Validate data integrity;Monitor violations;Enforce data quality","Establish data modeling standards;Implement constraint enforcement;Monitor data quality;Train team on constraints",Data Modeler
R56,Over-aggressive caching leading to users viewing outdated metrics.,"Stale data;User confusion;Incorrect decisions;Trust issues","Optimize cache TTL;Implement cache invalidation;Monitor data freshness;Balance performance vs freshness","Establish caching policies;Implement cache monitoring;Create freshness indicators;Train users on data freshness",Data Engineer
R57,Failure of Fail-safe period in Snowflake during a catastrophic drop.,"Data loss;Recovery failures;Business continuity issues;Compliance violations","Implement proper backup strategy;Test recovery procedures;Use Time Travel appropriately;Document recovery processes","Establish backup and recovery policies;Implement disaster recovery testing;Monitor backup status;Train team on recovery procedures",Database Administrator
R58,Ghost data: Table clones not updated with the latest source changes.,"Stale clones;Data inconsistency;Testing issues;Deployment problems","Implement clone refresh strategy;Monitor clone staleness;Automate clone updates;Document clone dependencies","Establish clone management policies;Implement automated refresh;Monitor clone freshness;Train team on clone management",DevOps Engineer
