risk_id,risk_type,detected_indicators,mitigation,suggestions,owner
R59,Performance degradation of Delta Live Tables (DLT) under high volume.,"Slow processing;SLA breaches;Resource exhaustion;Backlog buildup","Optimize DLT pipelines;Scale resources appropriately;Monitor performance;Implement performance tuning","Conduct performance analysis;Implement optimization best practices;Monitor DLT metrics;Train team on DLT optimization",Data Engineer
R60,Unhandled Nulls in PySpark transformations causing job crashes.,"Job failures;Data processing errors;Pipeline interruptions;Business impact","Implement null handling;Add data validation;Use appropriate functions;Test edge cases","Establish coding standards;Implement comprehensive testing;Monitor job failures;Train team on null handling",Data Engineer
R61,Over-privileged ACCOUNTADMIN roles used for daily operations.,"Security risks;Audit compliance issues;Excessive permissions;Potential for misuse","Implement least privilege principle;Use role-based access control;Audit role usage;Restrict ACCOUNTADMIN usage","Establish access control policies;Implement regular access reviews;Monitor privileged access;Train team on security best practices",Security Lead
R62,PII exposure due to lack of Dynamic Data Masking policies.,"Privacy violations;Compliance risks;Data exposure;Regulatory penalties","Implement dynamic data masking;Classify sensitive data;Apply masking policies;Monitor data access","Establish data classification framework;Implement comprehensive masking;Conduct privacy audits;Train team on privacy requirements",Privacy Officer
R63,Data exfiltration via Databricks Notebooks with external internet access.,"Security breach risk;Data leakage;Compliance violations;Unauthorized access","Restrict internet access from notebooks;Implement network policies;Monitor outbound connections;Use private endpoints","Establish security policies;Implement network monitoring;Conduct security audits;Train team on security practices",Security Lead
R64,Weak Network Policies allowing access from unauthorized IP ranges.,"Unauthorized access risk;Security vulnerabilities;Compliance issues;Potential breaches","Implement strict network policies;Whitelist authorized IPs;Monitor access attempts;Regular policy reviews","Establish network security standards;Implement continuous monitoring;Conduct penetration testing;Train team on network security",Network Security Engineer
R65,Failure to rotate Service Principal secrets or API Tokens.,"Security vulnerabilities;Compliance violations;Credential compromise risk;Audit failures","Implement automated secret rotation;Use secret management tools;Monitor secret age;Establish rotation policies","Establish secret management framework;Implement automated rotation;Monitor compliance;Train team on secret management",Security Engineer
R66,Insecure sharing of data via Snowflake Reader Accounts.,"Data exposure risk;Unauthorized access;Compliance violations;Security breaches","Implement secure sharing practices;Use appropriate access controls;Monitor shared data;Regular access reviews","Establish data sharing policies;Implement access monitoring;Conduct security audits;Train team on secure sharing",Security Lead
R67,Row-Level Security (RLS) performance hit on large scale joins.,"Query performance degradation;High latency;Resource contention;User experience issues","Optimize RLS implementation;Use appropriate security models;Monitor performance impact;Consider alternative approaches","Conduct performance analysis;Implement optimization strategies;Balance security vs performance;Train team on RLS optimization",Security Architect
R68,Lack of Audit Logs analysis to detect suspicious query patterns.,"Undetected security threats;Compliance gaps;Reactive security;Missed anomalies","Implement log analysis;Use SIEM tools;Set up anomaly detection;Regular log reviews","Establish security monitoring framework;Implement automated analysis;Create alerting rules;Train team on threat detection",Security Analyst
R69,Unencrypted data in transit between on-prem and cloud storage.,"Data exposure risk;Compliance violations;Security vulnerabilities;Regulatory penalties","Implement encryption in transit;Use TLS/SSL;Validate encryption;Monitor connections","Establish encryption standards;Implement encryption monitoring;Conduct security audits;Train team on encryption requirements",Security Engineer
R70,Governance gap: Objects created without Unity Catalog management.,"Governance challenges;Compliance issues;Data discovery problems;Access control gaps","Enforce Unity Catalog usage;Implement governance policies;Monitor object creation;Establish standards","Establish governance framework;Implement policy enforcement;Conduct governance audits;Train team on Unity Catalog",Data Governance Lead
R71,Accidental public exposure of Cloud Storage Buckets (S3/GCS).,"Data breach risk;Compliance violations;Public data exposure;Regulatory penalties","Implement bucket policies;Use private access;Monitor public access;Regular security audits","Establish cloud security policies;Implement automated scanning;Conduct security training;Monitor compliance",Cloud Security Engineer
R72,GDPR/CCPA Right to be Forgotten failure in immutable Delta logs.,"Compliance violations;Privacy breaches;Regulatory penalties;Legal liability","Implement data deletion procedures;Use Delta Lake VACUUM;Document deletion processes;Maintain compliance records","Establish privacy compliance framework;Implement deletion workflows;Conduct compliance audits;Train team on privacy regulations",Privacy Officer
R73,Shared Workspace IDs leading to cross-client data visibility.,"Data isolation breach;Privacy violations;Security risks;Compliance issues","Implement proper workspace isolation;Use separate workspaces;Enforce access controls;Regular access audits","Establish multi-tenancy policies;Implement isolation monitoring;Conduct security reviews;Train team on isolation requirements",Security Architect
R74,Lack of Multi-Factor Authentication (MFA) for federated identities.,"Unauthorized access risk;Security vulnerabilities;Compliance gaps;Account compromise","Implement MFA for all users;Enforce MFA policies;Monitor authentication;Regular security reviews","Establish authentication policies;Implement MFA enforcement;Conduct security audits;Train users on MFA importance",Identity and Access Manager
R75,SQL Injection vulnerabilities in custom Streamlit or Dash apps.,"Security vulnerabilities;Data breach risk;Unauthorized access;Application compromise","Implement parameterized queries;Use input validation;Conduct security testing;Apply security best practices","Establish secure coding standards;Implement security scanning;Conduct penetration testing;Train developers on security",Application Security Engineer
R76,Insider threat: Data Scientists downloading datasets via notebooks.,"Data exfiltration risk;Privacy violations;Compliance issues;Intellectual property theft","Implement download restrictions;Monitor data access;Use DLP tools;Enforce data handling policies","Establish data access policies;Implement monitoring and alerting;Conduct security awareness training;Regular access reviews",Security Lead
R77,Failure to use Scoped Credentials for external location access.,"Security vulnerabilities;Excessive permissions;Compliance risks;Credential exposure","Implement scoped credentials;Use least privilege access;Rotate credentials regularly;Monitor credential usage","Establish credential management policies;Implement automated credential management;Conduct security audits;Train team on credential security",Security Engineer
R78,Compliance failure: Data residency (e.g. EU data in US region).,"Regulatory violations;Legal liability;Compliance penalties;Data sovereignty issues","Implement data residency policies;Use appropriate regions;Monitor data location;Enforce compliance","Establish data residency framework;Implement location monitoring;Conduct compliance audits;Train team on residency requirements",Compliance Officer
R79,Insecure Python libraries installed in the compute environment.,"Security vulnerabilities;Supply chain attacks;Malware risk;Compliance issues","Implement library scanning;Use approved libraries;Monitor vulnerabilities;Regular security updates","Establish library governance;Implement vulnerability scanning;Conduct security reviews;Train team on secure dependencies",Security Engineer
R80,Misconfiguration of Snowflake Managed Access Schemas.,"Access control issues;Security gaps;Compliance violations;Unauthorized access","Properly configure managed access;Implement access controls;Regular configuration reviews;Monitor access patterns","Establish access control standards;Implement configuration management;Conduct security audits;Train team on managed access",Database Administrator
R81,Lack of CI/CD for Snowflake DDL (e.g. not using Schemachange/Terraform).,"Manual deployment errors;Inconsistent environments;Deployment delays;Configuration drift","Implement CI/CD pipelines;Use infrastructure as code;Automate deployments;Version control DDL","Establish DevOps practices;Implement automated testing;Conduct deployment reviews;Train team on CI/CD",DevOps Engineer
R82,Notebook version control conflicts in Databricks Repos (Git).,"Code conflicts;Deployment issues;Collaboration problems;Lost work","Implement Git best practices;Use branching strategies;Resolve conflicts promptly;Regular code reviews","Establish version control standards;Implement conflict resolution procedures;Conduct Git training;Monitor repository health",DevOps Engineer
R83,Long-running Spark jobs blocking the deployment pipeline.,"Deployment delays;Pipeline bottlenecks;Release delays;Operational inefficiency","Optimize job performance;Implement job timeouts;Use separate environments;Parallelize deployments","Conduct performance optimization;Implement deployment strategies;Monitor pipeline metrics;Train team on optimization",DevOps Engineer
R84,Skills Gap: Team lacks proficiency in PySpark/Scala performance tuning.,"Suboptimal performance;High costs;Inefficient code;Knowledge gaps","Provide training programs;Hire experienced engineers;Implement mentoring;Create knowledge base","Establish training curriculum;Implement skills assessment;Conduct regular training;Build internal expertise",Engineering Manager
R85,Skills Gap: Team treats Snowflake like a legacy RDBMS (over-indexing).,"Inefficient usage;Missed optimization opportunities;Higher costs;Suboptimal performance","Provide Snowflake-specific training;Implement best practices;Code reviews;Create guidelines","Establish Snowflake training program;Implement best practice documentation;Conduct knowledge sharing;Build Snowflake expertise",Engineering Manager
R86,Environment Parity: Dev QA and Prod have different cluster configs.,"Environment inconsistencies;Deployment issues;Testing gaps;Production surprises","Implement infrastructure as code;Maintain environment parity;Automate provisioning;Regular audits","Establish environment standards;Implement configuration management;Conduct parity checks;Train team on environment management",DevOps Engineer
R87,Dependency Hell: Conflicting libraries in Databricks Init Scripts.,"Job failures;Dependency conflicts;Deployment issues;Operational problems","Implement dependency management;Use virtual environments;Test dependencies;Document requirements","Establish dependency management practices;Implement automated testing;Conduct dependency audits;Train team on dependency management",Platform Engineer
R88,Failure of Disaster Recovery (DR) replication across regions.,"Business continuity risk;Data loss risk;Recovery failures;Compliance issues","Implement robust DR strategy;Test DR procedures;Monitor replication;Maintain DR documentation","Establish DR framework;Implement regular DR testing;Conduct DR audits;Train team on DR procedures",Infrastructure Architect
R89,Lack of observability: No dashboards to monitor pipeline health/SLA.,"Operational blindness;Reactive problem solving;SLA breaches;Missed issues","Implement comprehensive monitoring;Create dashboards;Set up alerting;Monitor SLAs","Establish observability framework;Implement monitoring best practices;Conduct regular reviews;Train team on monitoring tools",Site Reliability Engineer
R90,Slow Time-to-Market due to manual approvals in data deployment.,"Deployment delays;Business impact;Competitive disadvantage;Operational inefficiency","Automate approval workflows;Implement automated testing;Use CI/CD;Reduce manual gates","Establish deployment automation;Implement governance automation;Conduct process optimization;Train team on automation",DevOps Manager
R91,Snowflake Warehouse Auto-Suspend set too low causing thrashing.,"Performance issues;High costs;Resource thrashing;User experience problems","Optimize auto-suspend settings;Monitor warehouse activity;Balance cost vs performance;Adjust based on usage patterns","Analyze usage patterns;Implement optimal configuration;Monitor performance metrics;Train team on warehouse management",Database Administrator
R92,Databricks Job clusters failing due to cloud provider Quota Exceeded.,"Job failures;Deployment issues;Operational disruptions;Business impact","Request quota increases;Monitor quota usage;Implement quota management;Use spot instances","Establish quota management;Implement quota monitoring;Conduct capacity planning;Coordinate with cloud provider",Cloud Operations Engineer
R93,Failure to test Snowflake Scripting (Stored Procs) at scale.,"Production issues;Performance problems;Scalability issues;Business impact","Implement performance testing;Test at scale;Monitor performance;Optimize procedures","Establish testing standards;Implement load testing;Conduct performance reviews;Train team on testing",Quality Assurance Engineer
R94,Orphaned Delta tables in storage after workspace deletion.,"Storage waste;Cost inefficiency;Compliance issues;Data management problems","Implement cleanup procedures;Monitor storage;Automate cleanup;Document table lifecycle","Establish data lifecycle policies;Implement automated cleanup;Conduct storage audits;Train team on data management",Data Engineer
R95,Poor documentation of complex SQL logic in views.,"Knowledge gaps;Maintenance difficulties;Onboarding challenges;Technical debt","Implement documentation standards;Document complex logic;Use comments;Maintain documentation","Establish documentation framework;Implement documentation reviews;Conduct knowledge sharing;Train team on documentation",Technical Writer
R96,Over-engineering: Using Spark for a task that fits a small SQL query.,"Unnecessary complexity;Higher costs;Operational overhead;Maintenance burden","Use appropriate tools;Implement architecture reviews;Apply KISS principle;Optimize tool selection","Establish architecture guidelines;Implement design reviews;Conduct complexity assessments;Train team on tool selection",Solution Architect
R97,Inability to roll back a production release in Snowflake (No Clone/Time Travel).,"Deployment risk;Recovery challenges;Business continuity issues;Operational problems","Implement rollback procedures;Use cloning;Leverage Time Travel;Test rollback scenarios","Establish deployment standards;Implement rollback automation;Conduct rollback testing;Train team on rollback procedures",DevOps Engineer
R98,API latency between Databricks and the cloud-native Orchestrator.,"Performance issues;Job delays;SLA breaches;Operational inefficiency","Optimize API calls;Implement caching;Monitor latency;Use efficient integration patterns","Analyze integration patterns;Implement optimization strategies;Monitor API performance;Train team on integration best practices",Integration Engineer
R99,High Mean Time to Repair (MTTR) due to lack of descriptive error logs.,"Extended outages;Operational inefficiency;Business impact;User frustration","Implement comprehensive logging;Use structured logging;Improve error messages;Create runbooks","Establish logging standards;Implement log aggregation;Conduct incident reviews;Train team on troubleshooting",Site Reliability Engineer
R100,Vendor Lock-in: Using too many proprietary features (e.g. Snowpipe Streaming).,"Migration difficulties;Vendor dependency;Cost negotiation challenges;Strategic risk","Use standard features where possible;Document proprietary dependencies;Maintain abstraction layers;Evaluate alternatives","Establish architecture principles;Implement portability assessments;Conduct regular reviews;Train team on portability considerations",Enterprise Architect